{"Binding_Schema_SHA256":"dabc461e47134b3b150be9aeb23b3d0097563493b33b3187538255e06b16a022","Binding_Schema_Version":"pr-grid-v2-binding/1.0","Boundary_Semantics_Version":"pr-grid-v2-boundary/1.0","CRS":"EPSG:6566","Cell_ID_Format":"PRG2:<LEVEL>:R<row:03d>:C<column:04d>","Cell_Schema_SHA256":"1c173aee4b21b9baa545b656735155f2236a87c436d467a12132ef53b2592f5d","Column_Direction":"WEST_TO_EAST","Extent_XMax":354000,"Extent_XMin":12000,"Extent_YMax":314000,"Extent_YMin":180000,"Full_Cell_Policy":"FULL_SQUARE","Geometry_Generator_Version":"pr-grid-geographic-v2/rc1","Grid_ID":"PR_GRID_GEOGRAPHIC_V2","Grid_Manifest_SHA256":"8902af188ad449955119016f5747fe2393c582d9ed552fb03bcaecd9ab510aa4","Grid_Version":"2.0.0-rc1","Levels":{"L0":{"cell_count":11457,"columns":171,"resolution_m":2000,"rows":67},"L1":{"cell_count":45828,"columns":342,"resolution_m":1000,"rows":134},"L2":{"cell_count":183312,"columns":684,"resolution_m":500,"rows":268},"L3":{"cell_count":733248,"columns":1368,"resolution_m":250,"rows":536}},"Manifest_Schema_SHA256":"650f00c3327c5dcd6e4c50d521e1d0df61bb3dd24e4958ae18af0038a36b0729","Mask_Schema_SHA256":"0b31b717d274b19686bf7f47edbabdaec31c86800f2ca7f1e73ffb663600978b","Mask_Schema_Version":"pr-grid-v2-mask/1.0","Origin_X":12000,"Origin_Y":180000,"Release_State":"RC1_CANDIDATE","Row_Direction":"SOUTH_TO_NORTH","Source_Manifest_SHA256":"5c2a778502ad73c96f7cc42436c8de3b3d1e51962ac73a8af2926e03a6508eae"}
